cohort_variable,cohort_definition,matched_top_1_cdm_definition,matched_top_1_cdm_variable,matched_top_1_similarity,in_top_1
AIBL Id,Participant ID.,An alphanumeric identifier assigned to a specific patient.,Participant ID,0.5317161784662673,True
Collection,Collection 18 month timepoint.,Huntington's Disease Cognitive Assessment Battery (HD-CAB) Trail Making Test-B key variable for composite score: Time to completion (sec) of TMT Part B with upper time limit of 240 seconds (reverse scored).,Trail Making Test (TMT) B,0.33098583594715514,False
CSF.Ab42_INNX_MELB,Ab1-42 CSF measurement using INNOTEST kit. Melbourne QXL.,The determination of the amount of the 1-42 amino acid beta amyloid protein isoform present in a sample.,A-beta 1-42 in CSF,0.6071954259621705,True
CSF.Tau_INNX_MELB,Total Tau CSF measurement using INNOTEST kit. Melbourne QXL.,"Is a quantification of total tau protein, a biomarker for Alzheimer's disease.",tTau in CSF,0.6464340986816467,True
Demographic.Sex,Participant gender.,An alphanumeric identifier assigned to a specific patient.,Participant ID,0.3530751287686285,False
Demographic.YearMonthOfBirth,Participant year and month of birth (YYYYMM).,The month in which a person was born.,Month of Birth,0.5097626492017819,True
Demographic.Present Living Arrangements,Present Living Arrangements,A description of a personal residence and the relationship between the occupants that reside there.,Living Arrangement,0.52903937923211,False
Demographic.Handedness,Handedness,The preferred hand of use for controlled and efficient performance of motor tasks.,Handedness,0.5778761385846974,True
Demographic.Years of Education Exact,Exact Years of Education,The number of education years that a subject has competed.,Education,0.6254958796311239,True
Demographic.AD/MCI/H/O at presentation,Classification at Presentation,Modified Hachinski Ischemic Scale-NACC Version (MHIS-NACC) Abrupt onset (re: cognitive status).,MHIS-NACC - Abrupt Onset,0.39645039292683715,False
Demographic.GDS,Total Score,Functional Activities Questionnaire (FAQ) Total Score.,Functional Activities Questionnaire (FAQ),0.5306716788477243,False
Demographic.ApoE genotype,ApoE Genotype,"Human APOE*4 allele is located in the vicinity of 19q13.2 and is approximately 4 kb in length. This allele, which encodes apolipoprotein E4, plays a role in triglyceride metabolism. The allele is associated with increased occurrence of both Alzheimer disease and coronary artery disease.",APOE Allele 1,0.6541821293721313,False
Demographic.Ever been diagnosed with Schizophrenia or Schizoaffective Disorder,Schizophrenia Diagnosis,"A major psychotic disorder characterized by abnormalities in the perception or expression of reality. It affects the cognitive and psychomotor functions. Common clinical signs and symptoms include delusions, hallucinations, disorganized thinking, and retreat from reality.",Schizophrenia,0.45490662254579006,True
Demographic.Ever been diagnosed with Bipolar Disorder,Bipolar Diagnosis,"A disorder of the brain that causes unusual shifts in mood, energy, activity levels and the ability to carry out day-to-day tasks. Often these moods range and shift from periods of elation and energized behavior to those of hopelessness and depression.",Bipolar,0.4220755953172699,True
Demographic.Ever been diagnosed with Parkinsons Disease,Parkinsons Diagnosis,"A progressive degenerative disorder of the central nervous system characterized by loss of dopamine producing neurons in the substantia nigra and the presence of Lewy bodies in the substantia nigra and locus coeruleus. Signs and symptoms include tremor which is most pronounced during rest, muscle rigidity, slowing of the voluntary movements, a tendency to fall back, and a mask-like facial expression.",Parkinson’s Disease,0.4780272683008293,True
Image.PET.Amyloid.PIB_NAV.Status,Amyloid status for PiB,Pittsburgh Compound-B Positron Emission Tomography,PiB PET,0.5848546918084587,True
Image.PET.Amyloid.Florbetapir.Status,Amyloid status for Florbetapir,Florbetapir F18 Positron Emission Tomography,AV45 PET,0.6589779175324229,True
Image.MR.CorticalGM.Vol.ICVCorr,Volume Grey Matter (ml),The volume of a brain.,Brain Volume,0.6626948117324922,False
Image.MR.CorticalWM.Vol.ICVCorr,Volume White Matter (ml),Left cortical white matter volume,Left Cortical White Matter Volume From Qdec,0.7311173224829189,False
Image.MR.Hippocampus.Vol.ICVCorr,Volume of the Hippocampus computed from MRI (mL).,Measurement of the volume of the hippocampus,Hippocampus Volume,0.7566528622466854,True
Medical History.Stroke,Stroke,A sudden loss of neurological function secondary to hemorrhage or ischemia in the brain parenchyma due to a vascular event.,Stroke,0.4832669792959933,True
Medical History.Diabetes,Diabetes,A metabolic disorder characterized by abnormally high blood sugar levels due to diminished production of insulin or insulin resistance/desensitization.,Diabetes,0.5398414807003801,True
Medical History.Visual Defects,Visual Defects,"Tests to assess the ability to focus on and discern objects, colors, depth, etc.",Vision,0.4502693248753916,True
Medical History.Cancer,Cancer,"A tumor composed of atypical neoplastic, often pleomorphic cells that invade other tissues. Malignant neoplasms often metastasize to distant anatomic sites and may recur after excision. The most common malignant neoplasms are carcinomas (adenocarcinomas or squamous cell carcinomas), Hodgkin and non-Hodgkin lymphomas, leukemias, melanomas, and sarcomas.",Cancer,0.37221167847843356,True
Medical History.History of Falls,Falls,"A sudden movement downward, usually resulting in injury. [ NCI ]",Fall,0.40690191154952327,True
Medical History.Kidney Disease,Kidney Disease,Medical history pertaining to the kidney,Renal,0.6132035697874175,True
Medical History.Serious Head Injury,Serious Head Injury,Trauma to the brain.,Traumatic Brain Injury,0.6205276435628201,False
Medical History.Neurological Disorders,Neurological Disorder,Medical history pertaining to nerves or the nervous system.,Neurological Disorder (Other than AD),0.44598770053974096,True
Medical History.Depression,Depression,"An emotional state characterized by feelings of sadness, emptiness, and/or tearfulness.",Depressed Mood,0.5255119968242092,False
Medical History.Anxiety,Anxiety,"A feeling of worry, nervousness, or unease about something with an uncertain outcome.",Anxiety,0.5995521244963773,True
Medical History.Ever have an alcoholic drink,Ever had an alcoholic drink?,"Consumption of liquids containing ethanol, including the behaviors associated with drinking the alcohol.",Alcohol,0.3937334382538373,True
Medical History.How often,How often take a drink?,"The use of alcoholic beverages to excess, either on individual occasions (\binge drinking\) or as a regular practice.",Alcohol Abuse,0.4250591067638045,True
Neuropsych.MMSE,Total score.,Functional Activities Questionnaire (FAQ) Total Score.,Functional Activities Questionnaire (FAQ),0.5392302771995998,False
Neuropsych.Total fwd + bk,Digital Span Test,"A neuropsychological test of visual attention and task switching that requires a subject to connect a sequence of 25 consecutive targets. It provides an easy to administer and reliable assessment of attention, sequencing, cognition, visual search, and motor function.",Trail Making Test (TMT) A,0.3972841680831046,False
Neuropsych.Recall RAW (LMII),Logical Memory Test Raw 2,A test to assess the visual memory.,Landscape Test,0.427031387927881,False
Neuropsych.FAS (total),Controlled Oral Word Association Test Total,"Alzheimer's Disease Assessment Scale-Cognitive CDISC Version (ADAS-Cog CDISC Version) Word recognition task for word 11 Trials 1, 2, 3.",Alzheimer's Disease Assessment Scale 11-item (ADAS11),0.45627609370041844,False
Neuropsych.Animals + Names (RAW),Animal + Names Raw score,Functional Activities Questionnaire (FAQ) Total Score.,Functional Activities Questionnaire (FAQ),0.3730717787714034,False
Neuropsych.Clock Score,Clock Score,A test of the ability of an individual to accurately place the numbers and hands of a clock in their usual and specified positions.,Clock Drawing Test,0.4405027971583806,True
Neuropsych.CDR score,CDR Global,Right_GC-ML-DG,Right GC-ML-DG Volume,0.47198758056950046,False
Neuropsych.CDR Sum of Boxes,Sum Of Boxes,Clinical Dementia Rating (CDR) Sum of Boxes.,Clinical Dementia Rating Scale Sum of Boxes (CDRSB),0.505443351058716,True
Neuropsych.HADS (D),Depression Total,Hospital Anxiety and Depression Scale (HADS) Total score depression.,Hospital Anxiety and Depression Scale (HADs) (Anxiety),0.5053184637977106,False
Neuropsych.HADS (A),Anxiety Total,Hospital Anxiety and Depression Scale (HADS) Total score depression.,Hospital Anxiety and Depression Scale (HADs) (Depression),0.5538447760328784,False
Vital Signs.Height,Height,The vertical measurement or distance from the base to the top of an object; the vertical dimension of extension.,Height,0.5036092820255823,True
Vital Signs.Weight,Weight,The vertical force exerted by a mass as a result of gravity.,Weight,0.4012053937493234,True
Vital Signs.Heart rate,Heart rate,"The number of heartbeats per unit of time, usually expressed as beats per minute.",Heart Rate,0.5791693022540148,True
Vital Signs.Body Mass Index,Body Mass Index,An individual's weight in kilograms divided by the square of the height in meters.,BMI,0.5497045366076339,True
Physical Activity.Days per week doing vigorous activity during leisure time,"As part of Recreation, sport and leisure, time spent doing vigorous activity answered in days per week","Functional Activities Questionnaire (FAQ) Playing a game of skill, working on a hobby.","FAQ - Play Game of Skill, Work on Hobby",0.42670504812322285,False
